{
  "$schema": "../../schemas/pricing-definition.schema.json",
  "version": 1,
  "definitionId": "modelarts",
  "serviceCode": "ModelArts",
  "serviceName": "ModelArts",
  "catalogAdapter": "modelarts",
  "rateSources": {
    "compute": {
      "catalogKey": "compute.prices",
      "description": "Normalized ModelArts compute instance rates from the productInfo catalog."
    },
    "storage": {
      "catalogKey": "storage.prices",
      "description": "Normalized ModelArts instance storage rate from the productInfo catalog."
    }
  },
  "metrics": [
    {
      "id": "computeInstances",
      "label": "Compute instances",
      "rateSource": "compute",
      "quantity": {
        "source": "field",
        "field": "quantity"
      },
      "enabledWhen": {
        "field": "resourceType",
        "notEquals": "EVS Storage"
      }
    },
    {
      "id": "instanceStorage",
      "label": "Instance storage",
      "rateSource": "storage",
      "quantity": {
        "source": "field",
        "field": "storageQuotaGb"
      },
      "unit": "GB",
      "enabledWhen": {
        "field": "resourceType",
        "equals": "EVS Storage"
      }
    }
  ]
}
